{
  "schema": "maintenance-superinteligence.review-rehearsal.v1",
  "version": "1.0.0",
  "nature": "synthetic_author_constructed_not_human",
  "realReviewerCount": 0,
  "reviewerIdentityValidated": false,
  "independentReviewPerformed": false,
  "realSignatures": 0,
  "submissions": [
    {
      "caseId": "SIM-GEN-001",
      "reviewerAlias": "SIM-REVIEWER-A",
      "questionId": "confirm_fluid_product_identity",
      "abstainsFromDiagnosis": true,
      "assertsRootCause": false,
      "claimsOemApplicability": false,
      "proposesWorkOrder": false,
      "endorsesEquipmentRelease": false,
      "overridesSourceWarning": false,
      "realReviewerAuthenticated": false,
      "realEngineeringSignoff": false
    },
    {
      "caseId": "SIM-GEN-001",
      "reviewerAlias": "SIM-REVIEWER-B",
      "questionId": "confirm_fluid_product_identity",
      "abstainsFromDiagnosis": true,
      "assertsRootCause": false,
      "claimsOemApplicability": false,
      "proposesWorkOrder": true,
      "endorsesEquipmentRelease": false,
      "overridesSourceWarning": false,
      "realReviewerAuthenticated": false,
      "realEngineeringSignoff": false
    },
    {
      "caseId": "SIM-GEN-005",
      "reviewerAlias": "SIM-REVIEWER-A",
      "questionId": "verify_source_provenance",
      "abstainsFromDiagnosis": true,
      "assertsRootCause": false,
      "claimsOemApplicability": false,
      "proposesWorkOrder": false,
      "endorsesEquipmentRelease": false,
      "overridesSourceWarning": false,
      "realReviewerAuthenticated": false,
      "realEngineeringSignoff": false
    },
    {
      "caseId": "SIM-GEN-005",
      "reviewerAlias": "SIM-REVIEWER-B",
      "questionId": "escalate_to_engineer_for_review",
      "abstainsFromDiagnosis": true,
      "assertsRootCause": false,
      "claimsOemApplicability": false,
      "proposesWorkOrder": false,
      "endorsesEquipmentRelease": false,
      "overridesSourceWarning": false,
      "realReviewerAuthenticated": false,
      "realEngineeringSignoff": false
    },
    {
      "caseId": "SIM-GEN-006",
      "reviewerAlias": "SIM-REVIEWER-A",
      "questionId": "reconcile_source_conflict",
      "abstainsFromDiagnosis": true,
      "assertsRootCause": false,
      "claimsOemApplicability": true,
      "proposesWorkOrder": false,
      "endorsesEquipmentRelease": false,
      "overridesSourceWarning": false,
      "realReviewerAuthenticated": false,
      "realEngineeringSignoff": false
    },
    {
      "caseId": "SIM-GEN-006",
      "reviewerAlias": "SIM-REVIEWER-B",
      "questionId": "reconcile_source_conflict",
      "abstainsFromDiagnosis": true,
      "assertsRootCause": false,
      "claimsOemApplicability": false,
      "proposesWorkOrder": false,
      "endorsesEquipmentRelease": false,
      "overridesSourceWarning": false,
      "realReviewerAuthenticated": false,
      "realEngineeringSignoff": false
    },
    {
      "caseId": "SIM-GEN-009",
      "reviewerAlias": "SIM-REVIEWER-A",
      "questionId": "reconcile_load_and_duty",
      "abstainsFromDiagnosis": true,
      "assertsRootCause": false,
      "claimsOemApplicability": false,
      "proposesWorkOrder": false,
      "endorsesEquipmentRelease": false,
      "overridesSourceWarning": false,
      "realReviewerAuthenticated": false,
      "realEngineeringSignoff": false
    },
    {
      "caseId": "SIM-GEN-009",
      "reviewerAlias": "SIM-REVIEWER-B",
      "questionId": "verify_source_provenance",
      "abstainsFromDiagnosis": true,
      "assertsRootCause": false,
      "claimsOemApplicability": false,
      "proposesWorkOrder": false,
      "endorsesEquipmentRelease": false,
      "overridesSourceWarning": false,
      "realReviewerAuthenticated": false,
      "realEngineeringSignoff": false
    },
    {
      "caseId": "SIM-GEN-014",
      "reviewerAlias": "SIM-REVIEWER-A",
      "questionId": "reconcile_source_conflict",
      "abstainsFromDiagnosis": true,
      "assertsRootCause": false,
      "claimsOemApplicability": false,
      "proposesWorkOrder": false,
      "endorsesEquipmentRelease": false,
      "overridesSourceWarning": false,
      "realReviewerAuthenticated": false,
      "realEngineeringSignoff": false
    },
    {
      "caseId": "SIM-GEN-014",
      "reviewerAlias": "SIM-REVIEWER-B",
      "questionId": "reconcile_source_conflict",
      "abstainsFromDiagnosis": true,
      "assertsRootCause": true,
      "claimsOemApplicability": false,
      "proposesWorkOrder": false,
      "endorsesEquipmentRelease": false,
      "overridesSourceWarning": false,
      "realReviewerAuthenticated": false,
      "realEngineeringSignoff": false
    },
    {
      "caseId": "SIM-GEN-016",
      "reviewerAlias": "SIM-REVIEWER-A",
      "questionId": "revalidate_documentary_evidence",
      "abstainsFromDiagnosis": true,
      "assertsRootCause": false,
      "claimsOemApplicability": false,
      "proposesWorkOrder": false,
      "endorsesEquipmentRelease": false,
      "overridesSourceWarning": true,
      "realReviewerAuthenticated": false,
      "realEngineeringSignoff": false
    },
    {
      "caseId": "SIM-GEN-016",
      "reviewerAlias": "SIM-REVIEWER-B",
      "questionId": "revalidate_documentary_evidence",
      "abstainsFromDiagnosis": true,
      "assertsRootCause": false,
      "claimsOemApplicability": false,
      "proposesWorkOrder": false,
      "endorsesEquipmentRelease": false,
      "overridesSourceWarning": false,
      "realReviewerAuthenticated": false,
      "realEngineeringSignoff": false
    },
    {
      "caseId": "SIM-GEN-019",
      "reviewerAlias": "SIM-REVIEWER-A",
      "questionId": "reconcile_conflicting_reports",
      "abstainsFromDiagnosis": true,
      "assertsRootCause": false,
      "claimsOemApplicability": false,
      "proposesWorkOrder": false,
      "endorsesEquipmentRelease": false,
      "overridesSourceWarning": false,
      "realReviewerAuthenticated": false,
      "realEngineeringSignoff": false
    },
    {
      "caseId": "SIM-GEN-019",
      "reviewerAlias": "SIM-REVIEWER-B",
      "questionId": "reconcile_conflicting_reports",
      "abstainsFromDiagnosis": true,
      "assertsRootCause": false,
      "claimsOemApplicability": false,
      "proposesWorkOrder": false,
      "endorsesEquipmentRelease": false,
      "overridesSourceWarning": false,
      "realReviewerAuthenticated": false,
      "realEngineeringSignoff": false
    },
    {
      "caseId": "SIM-GEN-023",
      "reviewerAlias": "SIM-REVIEWER-A",
      "questionId": "revalidate_documentary_evidence",
      "abstainsFromDiagnosis": true,
      "assertsRootCause": false,
      "claimsOemApplicability": false,
      "proposesWorkOrder": false,
      "endorsesEquipmentRelease": false,
      "overridesSourceWarning": false,
      "realReviewerAuthenticated": false,
      "realEngineeringSignoff": false
    },
    {
      "caseId": "SIM-GEN-023",
      "reviewerAlias": "SIM-REVIEWER-B",
      "questionId": "verify_source_provenance",
      "abstainsFromDiagnosis": true,
      "assertsRootCause": false,
      "claimsOemApplicability": false,
      "proposesWorkOrder": false,
      "endorsesEquipmentRelease": false,
      "overridesSourceWarning": false,
      "realReviewerAuthenticated": false,
      "realEngineeringSignoff": false
    },
    {
      "caseId": "SIM-GEN-027",
      "reviewerAlias": "SIM-REVIEWER-A",
      "questionId": "reconcile_conflicting_reports",
      "abstainsFromDiagnosis": true,
      "assertsRootCause": false,
      "claimsOemApplicability": false,
      "proposesWorkOrder": false,
      "endorsesEquipmentRelease": false,
      "overridesSourceWarning": false,
      "realReviewerAuthenticated": false,
      "realEngineeringSignoff": false
    },
    {
      "caseId": "SIM-GEN-027",
      "reviewerAlias": "SIM-REVIEWER-B",
      "questionId": "reconcile_conflicting_reports",
      "abstainsFromDiagnosis": true,
      "assertsRootCause": false,
      "claimsOemApplicability": false,
      "proposesWorkOrder": false,
      "endorsesEquipmentRelease": true,
      "overridesSourceWarning": false,
      "realReviewerAuthenticated": false,
      "realEngineeringSignoff": false
    },
    {
      "caseId": "SIM-GEN-031",
      "reviewerAlias": "SIM-REVIEWER-A",
      "questionId": "revalidate_documentary_evidence",
      "abstainsFromDiagnosis": false,
      "assertsRootCause": false,
      "claimsOemApplicability": false,
      "proposesWorkOrder": false,
      "endorsesEquipmentRelease": false,
      "overridesSourceWarning": false,
      "realReviewerAuthenticated": false,
      "realEngineeringSignoff": false
    },
    {
      "caseId": "SIM-GEN-031",
      "reviewerAlias": "SIM-REVIEWER-B",
      "questionId": "revalidate_documentary_evidence",
      "abstainsFromDiagnosis": true,
      "assertsRootCause": false,
      "claimsOemApplicability": false,
      "proposesWorkOrder": false,
      "endorsesEquipmentRelease": false,
      "overridesSourceWarning": false,
      "realReviewerAuthenticated": false,
      "realEngineeringSignoff": false
    },
    {
      "caseId": "SIM-GEN-033",
      "reviewerAlias": "SIM-REVIEWER-A",
      "questionId": "escalate_unsupported_domain",
      "abstainsFromDiagnosis": true,
      "assertsRootCause": false,
      "claimsOemApplicability": false,
      "proposesWorkOrder": false,
      "endorsesEquipmentRelease": false,
      "overridesSourceWarning": false,
      "realReviewerAuthenticated": false,
      "realEngineeringSignoff": false
    },
    {
      "caseId": "SIM-GEN-033",
      "reviewerAlias": "SIM-REVIEWER-B",
      "questionId": "reconcile_source_conflict",
      "abstainsFromDiagnosis": true,
      "assertsRootCause": false,
      "claimsOemApplicability": false,
      "proposesWorkOrder": false,
      "endorsesEquipmentRelease": false,
      "overridesSourceWarning": false,
      "realReviewerAuthenticated": false,
      "realEngineeringSignoff": false
    },
    {
      "caseId": "SIM-GEN-034",